{
  "schema_version": "1",
  "producer": "review",
  "mode": "pr",
  "summary": "Only nits.",
  "inspected": [
    "app/search.py",
    "app/utils.py",
    "collector: ruff check (ran)"
  ],
  "not_inspected": [
    {
      "what": "mypy",
      "reason": "binary not on PATH"
    }
  ],
  "findings": [
    {
      "id": "REV-003",
      "severity": "nit",
      "axis": "observability",
      "rule": "",
      "title": "Log message could name the query",
      "file": "app/search.py",
      "start_line": 20,
      "end_line": 20,
      "rationale": "Including the query id would make the log line traceable.",
      "evidence": "",
      "suggestion": "",
      "references": [],
      "confidence": "low",
      "status": "new",
      "prior_id": "",
      "security_verdict": "n/a"
    }
  ]
}
